title,preptime,category,ingredients,instructions,picture_link,recipeby,calories,carbohydrates,sodium,cholestrol,fat,protiens,Main_Category
Crispy Honey Sriracha Chicken Wings,55 mins ,Meat and Poultry#Chicken#Wings,"2 tablespoons baking powder# 1 tablespoon kosher salt# 1 teaspoon freshly ground black pepper# 1 teaspoon smoked paprika# ½ pounds chicken wing sections#1 cup honey#1 cup sriracha sauce# 1 tablespoon seasoned rice vinegar#¼ teaspoon sesame oil# 1 pinch sesame seeds, or as desired","Preheat oven to 425 degrees F (220 degrees C). Line a baking sheet with aluminum foil and place an oven-proof wire rack over the foil.# Whisk baking powder, salt, black pepper, and paprika together in a small bowl. Place chicken wings in a large bowl. Sprinkle 1/2 of the baking powder mixture over wings and toss to coat. Sprinkle remaining baking powder mixture over wings and toss to coat again. Place wings onto the rack of the prepared baking sheet.# Bake in the preheated oven for 20 minutes. Turn wings and continue baking for 20 minutes. Turn wings again and bake until wings are browned and crispy, about 15 minutes more. Transfer wings to a large bowl.# Whisk honey, sriracha sauce, rice vinegar, and sesame oil together in a bowl until glaze is smooth. Drizzle glaze over wings and toss to coat completely. Transfer wings to a serving platter and sprinkle sesame seeds over the top.",https://imagesvc.meredithcorp.io/v3/mm/image?url=https%3A%2F%2Fimages.media-allrecipes.com%2Fuserphotos%2F9396572.jpg&w=1200&h=678&c=sc&poi=face&q=60,Darla K,315,28.7g,3151.9mg.,59.4mg,14.3g,19.3g,Meat and Poultry
Sweet Russian Cabbage Soup,1 hr ,Soups# Stews and Chili Recipes#Soup Recipes#Vegetable Soup Recipes#Cabbage Soup Recipes,"½ pounds ground lean beef# 1 (14.5 ounce) can diced tomatoes# 1 (8 ounce) can tomato sauce# 4 cubes beef bouillon# 2 medium carrots, shredded# 1 onion, chopped# 2 tablespoons white vinegar#½ cup white sugar# ½ teaspoons salt#½ teaspoon ground black pepper# 2 quarts water, divided# 3 cloves garlic, finely chopped# 1 head cabbage, cored and cut into wedges","Crumble the ground beef into a large pot. Add the diced tomatoes, tomato sauce, beef bouillon cubes, carrots, onion, vinegar, sugar, salt and pepper. Pour in 1 quart of water, and bring to a boil. Stir to break up the beef while heating. Once the soup comes to a boil, cover and simmer for 30 minutes over low heat.# Pour in another quart of water, and return to a slow boil. Add garlic and cabbage. Simmer for 25 minutes, until cabbage is tender. Ladle into soup bowls to serve.",https://imagesvc.meredithcorp.io/v3/mm/image?url=https%3A%2F%2Fimages.media-allrecipes.com%2Fuserphotos%2F1244128.jpg,Chef John,688,55.5g,2396.3mg.,127.8mg,35.9g,36.9g,Soups
Pigs in a Blanket,20 mins ,Meat and Poultry#Pork,8 frankfurters# 8 slices American processed cheese# 1 (10 ounce) package refrigerated biscuit dough,"Preheat oven to 350 degrees F (175 degrees C).# ""Wrap cheese around each frankfurter then the biscuit around that. Put on cookie sheet with the overlap of biscuit faced down, so you dont have to use tooth picks."", Bake in preheated oven until biscuits are brown, about 10 to 15 minutes.",https://imagesvc.meredithcorp.io/v3/mm/image?url=https%3A%2F%2Fimages.media-allrecipes.com%2Fuserphotos%2F4843993.jpg,BethAnne923,458,24.8g,1760.4mg.,57.1mg,31.8g,17.1g,Meat and Poultry
Salmon with Lemon and Dill,25 mins ,Main Dishes#Seafood Main Dishes#Salmon#Baked Salmon Recipes,"1 pound salmon fillets#¼ cup butter, melted# 5 tablespoons lemon juice# 1 tablespoon dried dill weed#¼ teaspoon garlic powder# sea salt to taste# freshly ground black pepper to taste","Preheat oven to 350 degrees F (175 degrees C). Lightly grease a medium baking dish.# Place salmon in the baking dish. Mix the butter and lemon juice in a small bowl, and drizzle over the salmon. Season with dill, garlic powder, sea salt, and pepper.# Bake 25 minutes in the preheated oven, or until salmon is easily flaked with a fork.",https://imagesvc.meredithcorp.io/v3/mm/image?url=https%3A%2F%2Fimages.media-allrecipes.com%2Fuserphotos%2F2363185.jpg,Jeannine Ross,320,2.4g,196.6mg.,104.3mg,22.1g,25.7g,Main Dishes
Honey BBQ Sauce,25 mins ,Side Dish#Sauces and Condiments#Sauces#BBQ Sauce Recipes,1 cup ketchup#½ cup honey#¼ cup white vinegar#¼ cup molasses# 1 teaspoon liquid smoke flavoring#½ teaspoon salt#½ teaspoon ground black pepper#¼ teaspoon paprika#¼ teaspoon chili powder#¼ teaspoon onion powder#¼ teaspoon garlic powder#¼ teaspoon cayenne pepper,"Stir ketchup, honey, vinegar, and molasses together in a saucepan over medium heat until smooth; add liquid smoke, salt, black pepper, paprika, chili powder, onion powder, garlic powder, and cayenne pepper. Stir the seasonings into the ketchup mixture, reduce heat to low, and simmer until thickened, about 20 minutes.n",https://imagesvc.meredithcorp.io/v3/mm/image?url=https%3A%2F%2Fimages.media-allrecipes.com%2Fuserphotos%2F9273258.jpg&w=1200&h=678&c=sc&poi=face&q=60,Natural Chef Michelle,65,16.5g,242.6mg.,0,0.4g,0.3g,Side Dish
World's Greatest Vegetable Broth,8 mins,Soups# Stews and Chili Recipes#Broth and Stock Recipes,"1 pound celery# ½ pounds sweet onions# 1 pound carrots, cut into 1 inch pieces# 1 pound tomatoes, cored# 1 pound green bell pepper, cut into 1 inch pieces#½ pound turnips, cubed# 2 tablespoons olive oil# 3 cloves garlic# 3 whole cloves# 1 bay leaf# 6 whole black peppercorns# 1 bunch fresh parsley, chopped# 1 gallon water","Preheat oven to 450 degrees F (230 degrees C).# Remove leaves and tender inner parts of celery and set aside.# Toss onions, carrots, tomatoes, bell peppers and turnips with olive oil. Place vegetables in a roasting pan and place them in the 450 degrees F (230 degrees C) oven. Stir the vegetable every 15 minutes. Cook until all of the vegetables have browned and the onions start to caramelize, this will take over one hour.# Put the browned vegetables, celery, garlic, cloves, bay leaf, pepper corns, Italian parsley and water into a large stock pot. Bring to a full boil. Reduce heat to simmer. Cook uncovered until liquid is reduced by half.# ""Pour the broth through a colander, catching the broth in a large bowl or pot. The liquid caught in the bowl or pot is your vegetable broth it can be used immediately or stored for later use. Although the vegetables are no longer necessary for your broth they are delicious to eat hot or cold, dont waste them!""",https://imagesvc.meredithcorp.io/v3/mm/image?url=https%3A%2F%2Fimages.media-allrecipes.com%2Fuserphotos%2F2648610.jpg,Katzen,133,23.3g,131.5mg.,0,4g,3.5g,Soups
Grandpa's Classic Coney Sauce,2 hrs ,Side Dish#Sauces and Condiments#Sauces,2 pounds ground beef#½ cup chopped onion# ½ cups ketchup#¼ cup white sugar#¼ cup white vinegar#¼ cup prepared yellow mustard#½ teaspoon celery seed#¾ teaspoon Worcestershire sauce#½ teaspoon ground black pepper#¾ teaspoon salt,"Place the ground beef and onion in a large skillet over medium-high heat. Cook, stirring to crumble, until beef is browned. Drain. Transfer the beef and onion to a slow cooker and stir in the ketchup, sugar, vinegar and mustard. Season with celery seed, Worcestershire sauce, pepper and salt. Cover and simmer on Low setting for a few hours before serving.",https://imagesvc.meredithcorp.io/v3/mm/image?url=https%3A%2F%2Fimages.media-allrecipes.com%2Fuserphotos%2F649489.jpg,peekers93,186,12.8g,586.1mg.,45.9mg,9.2g,13.5g,Side Dish
Asparagus Quiche,35 mins ,Breakfast and Brunch#Eggs#Quiche,"1 pound fresh asparagus, trimmed and cut into 1/2 inch pieces# 10 slices bacon# 2 (8 inch) unbaked pie shells# 1 egg white, lightly beaten# 4 large eggs eggs# ½ cups half-and-half cream#¼ teaspoon ground nutmeg# salt and pepper to taste# 2 cups shredded Swiss cheese","Preheat oven to 400 degrees F (200 degrees C). Place asparagus in a steamer over 1 inch of boiling water, and cover. Cook until tender but still firm, about 2 to 6 minutes. Drain and cool.# Place bacon in a large, deep skillet. Cook over medium high heat until evenly brown. Drain, crumble and set aside.# Brush pie shells with beaten egg white. Sprinkle crumbled bacon and chopped asparagus into pie shells.# In a bowl, beat together eggs, cream, nutmeg, salt and pepper. Sprinkle Swiss cheese over bacon and asparagus. Pour egg mixture on top of cheese.# Bake uncovered in preheated oven until firm, about 35 to 40 minutes. Let cool to room temperature before serving.",https://imagesvc.meredithcorp.io/v3/mm/image?url=https%3A%2F%2Fstatic.onecms.io%2Fwp-content%2Fuploads%2Fsites%2F43%2F2021%2F11%2F04%2Fimage-146.jpg,MJ46NY,334,12.4g,383.1mg.,105.6mg,26.3g,12.4g,Breakfast and Brunch
Oven-Baked Teriyaki Chicken Thighs,40 mins ,World Cuisine#Asian,"½ cup pineapple juice#½ cup reduced-sodium soy sauce# 3 tablespoons water# 2 tablespoons rice vinegar# 2 teaspoons cornstarch# 1 teaspoon minced fresh ginger root# 1 clove garlic, minced# ½ pounds boneless, skinless chicken thighs# 1 teaspoon toasted sesame seeds","Preheat the oven to 375 degrees F (190 degrees C).# Place a saucepan over medium-high heat. Add pineapple juice, soy sauce, water, rice vinegar, cornstarch, ginger, and garlic; stir to combine. Bring to a boil and stir well. Reduce heat to medium and cook, stirring often, until sauce is reduced, about 5 minutes.# Place chicken thighs in an oven-safe casserole dish. Pour 1/2 of the teriyaki sauce over the chicken thighs.# Bake in the preheated oven for 30 minutes, basting thighs every 10 minutes with the remaining sauce. Garnish with sesame seeds.",https://imagesvc.meredithcorp.io/v3/mm/image?url=https%3A%2F%2Fimages.media-allrecipes.com%2Fuserphotos%2F8453487.jpg&w=1200&h=678&c=sc&poi=face&q=60,Jim Richard,184,5.6g,773.9mg.,70mg,8.3g,20.4g,World Cuisine
Air Fryer Chicken Kiev,10 mins ,Meat and Poultry#Chicken#Fried Chicken Recipes,"4 tablespoons butter, softened# 2 tablespoons chopped fresh flat-leaf parsley# 1 clove garlic, minced# 1 teaspoon salt# 2 (8 ounce) skinless, boneless chicken breast halves, pounded to 1/4-inch thickness# salt and ground black pepper to taste# 2 sheets plastic wrap#½ cup all-purpose flour# 1 egg, beaten# 1 cup panko bread crumbs# 1 teaspoon paprika# nonstick cooking spray","Mix butter, parsley, garlic, and salt together in a bowl until evenly combined. Divide herbed butter in half and place on a baking sheet. Freeze for 10 minutes.# Place chicken on a clean work surface and season with salt and pepper. Place 1/2 of the herbed butter in the center of each pounded chicken breast. Gather the sides of the chicken up around the butter mixture. Cover each ball of chicken in plastic wrap and twist to secure. Place back on the baking sheet and freeze for 30 minutes.# Meanwhile, preheat an air fryer to 400 degrees F (200 degrees C).# Place flour in a bowl, beaten egg in a second bowl, and panko and paprika in a third bowl. Remove plastic from chicken. Dredge each chicken breast first in flour, then in beaten egg, and finally in panko bread crumb mixture.# Place breaded chicken in the basket of the air fryer. Spray the tops with cooking spray.# Air fry for 5 minutes. Spray with nonstick spray again and cook for 5 minutes more. Transfer to a cutting board and let rest for 5 minutes.",https://imagesvc.meredithcorp.io/v3/mm/image?url=https%3A%2F%2Fimages.media-allrecipes.com%2Fuserphotos%2F7737441.jpg,Suzanne EE,783,63.7g,1826.3mg.,292.4mg,35.1g,63.5g,Meat and Poultry
Candied Almonds,15 mins ,Appetizers and Snacks#Nuts and Seeds,½ cup water# 1 cup white sugar# 1 tablespoon ground cinnamon# 2 cups whole almonds,"Combine the water, sugar, and cinnamon in a saucepan over medium heat; bring to a boil; add the almonds. Cook and stir the mixture until the liquid evaporates and leaves a syrup-like coating on the almonds. Pour the almonds onto a baking sheet lined with waxed paper. Separate almonds using forks. Allow to cool about 15 minutes.",https://imagesvc.meredithcorp.io/v3/mm/image?url=https%3A%2F%2Fstatic.onecms.io%2Fwp-content%2Fuploads%2Fsites%2F43%2F2019%2F11%2F7004099-2000.jpg,Melissa Jennings Lake,304,32.7g,0.9mg.,0,18g,7.6g,Appetizers and Snacks
