title,preptime,category,ingredients,instructions,picture_link,recipeby,calories,carbohydrates,sodium,cholestrol,fat,protiens,Main_Category
Slow Cooker Taco Soup,10 mins ,Soups# Stews and Chili Recipes#Soup Recipes#Taco Soup Recipes,"1 pound ground beef# 1 onion, chopped# 1 (16 ounce) can chili beans, with liquid# 1 (15 ounce) can kidney beans with liquid# 1 (15 ounce) can whole kernel corn, with liquid# 1 (8 ounce) can tomato sauce# 2 cups water# 2 (14.5 ounce) cans peeled and diced tomatoes# 1 (4 ounce) can diced green chile peppers# 1 (1.25 ounce) package taco seasoning mix","In a medium skillet, cook the ground beef until browned over medium heat. Drain, and set aside.# Place the ground beef, onion, chili beans, kidney beans, corn, tomato sauce, water, diced tomatoes, green chile peppers and taco seasoning mix in a slow cooker. Mix to blend, and cook on Low setting for 8 hours.",https://imagesvc.meredithcorp.io/v3/mm/image?url=https%3A%2F%2Fstatic.onecms.io%2Fwp-content%2Fuploads%2Fsites%2F43%2F2020%2F03%2Fslow-cooker-taco-soup-photo-by-ttv78-5941186.jpg,Janeen Barlow,362,37.8g,1356mg.,48.5mg,16.3g,18.2g,Soups
Super Easy Egg Casserole,15 mins ,Breakfast and Brunch#Eggs,"1 cup shredded Cheddar cheese# 6 eggs, whisked# 6 slices bacon, diced# 2 slices bread, cubed# â…“ red bell pepper, diced# 2 green onions, chopped# 3 tablespoons milk# Â½ teaspoon minced garlic, or to taste (Optional)# salt and ground black pepper to taste","Preheat oven to 350 degrees F (175 degrees C). Grease a 9x13-inch baking dish.# Stir Cheddar cheese, eggs, bacon, bread, red bell pepper, green onion, milk, garlic, salt, and black pepper together in a bowl until well-combined; pour into prepared baking dish.# Bake in the preheated oven until eggs are set, 20 to 25 minutes.",https://imagesvc.meredithcorp.io/v3/mm/image?url=https%3A%2F%2Fstatic.onecms.io%2Fwp-content%2Fuploads%2Fsites%2F43%2F2020%2F07%2F28%2FSuper-Easy-Egg-Casserole-by-Chef-V.jpg,5MOM,340,9.3g,728.3mg.,324.7mg,23.2g,23.2g,Breakfast and Brunch
Old-Fashioned Chocolate Fudge,60 mins,Desserts#Candy Recipes#Fudge Recipes#Chocolate,2 cups white sugar# ½ cup cocoa# 1 cup milk# 4 tablespoons butter# 1 teaspoon vanilla extract,"Grease an 8x8 inch square baking pan. Set aside.# Combine sugar, cocoa and milk in a medium saucepan. Stir to blend, then bring to a boil, stirring constantly. Reduce heat and simmer. Do not stir again.# Place candy thermometer in pan and cook until temperature reaches 238 degrees F(114 degrees C). If you are not using a thermometer, then cook until a drop of this mixture in a cup of cold water forms a soft ball. Feel the ball with your fingers to make sure it is the right consistency. It should flatten when pressed between your fingers.# Remove from heat. Add butter or margarine and vanilla extract. Beat with a wooden spoon until the fudge loses its sheen. Do not under beat.# Pour into prepared pan and let cool. Cut into about 60 squares.",https://imagesvc.meredithcorp.io/v3/mm/image?url=https%3A%2F%2Fstatic.onecms.io%2Fwp-content%2Fuploads%2Fsites%2F43%2F2022%2F01%2F17%2F9420-old-fashioned-chocolate-fudge-mfs438-1.jpg,BOOK_WORM,37,7.3g,7.3mg.,2.4mg,0.9g,0.3g,Desserts
Hot Toddy,5 mins ,Drink Recipes#Cocktail Recipes#Whiskey Drinks Recipes,1 teaspoon honey# 2 fluid ounces boiling water# ½ fluid ounces whiskey# 3 whole cloves# 1 cinnamon stick# 1 slice lemon# 1 pinch ground nutmeg,"Pour the honey, boiling water, and whiskey into a mug. Spice it with the cloves and cinnamon, and put in the slice of lemon. Let the mixture stand for 5 minutes so the flavors can mingle, then sprinkle with a pinch of nutmeg before serving.",https://imagesvc.meredithcorp.io/v3/mm/image?url=https%3A%2F%2Fimages.media-allrecipes.com%2Fuserphotos%2F4696584.jpg,SWIZZLESTICKS,135,8.1g,2.6mg.,0mg,0.4g,0.2g,Drink Recipes
Gingerbread Men Cookies,20 mins ,Trusted Brands: Recipes and Tips#McCormick&reg;,"3 cups flour# 2 teaspoons McCormickÂ® Ginger, Ground# 1 teaspoon McCormickÂ® Cinnamon, Ground# 1 teaspoon baking soda# ¼ teaspoon McCormickÂ® Nutmeg, Ground# ¼ teaspoon salt# ¾ cup butter, softened# ¾ cup firmly packed brown sugar# ½ cup molasses# 1 egg# 1 teaspoon McCormick® Pure Vanilla Extract","Mix flour, ginger, cinnamon, baking soda, nutmeg and salt in large bowl. Set aside. Beat butter and brown sugar in large bowl with electric mixer on medium speed until light and fluffy. Add molasses, egg and vanilla;mix well. Gradually beat in flour mixture on low speed until well mixed. Press dough into a thick flat disk. Wrap in plastic wrap. Refrigerate 4 hours or overnight.# Preheat oven to 350 degrees F. Roll out dough to 1/4-inch thickness on lightly floured work surface. Cut into gingerbread men shapes with 5-inch cookie cutter. Place 1 inch apart on ungreased baking sheets.# Bake 8 to 10 minutes or until edges of cookies are set and just begin to brown. Cool on baking sheets 1 to 2 minutes. Remove to wire racks; cool completely. Decorate cooled cookies as desired. Store cookies in airtight container up to5 days.",https://imagesvc.meredithcorp.io/v3/mm/image?url=https%3A%2F%2Fimages.media-allrecipes.com%2Fuserphotos%2F4696584.jpg,McCormick Spice,158,24g,125.3mg.,23mg,6.1g,2g,Trusted Brands: Recipes and Tips
Healing Cabbage Soup,30 mins ,Soups# Stews and Chili Recipes#Soup Recipes#Vegetable Soup Recipes#Cabbage Soup Recipes,"3 tablespoons olive oil#½ onion, chopped# 2 cloves garlic, chopped# 2 quarts water# 4 teaspoons chicken bouillon granules# 1 teaspoon salt, or to taste# ½ teaspoon black pepper, or to taste# ½ head cabbage, cored and coarsely chopped# 1 (14.5 ounce) can Italian-style stewed tomatoes, drained and diced","In a large stockpot, heat olive oil over medium heat. Stir in onion and garlic; cook until onion is transparent, about 5 minutes.# Stir in water, bouillon, salt, and pepper. Bring to a boil, then stir in cabbage. Simmer until cabbage wilts, about 10 minutes.# Stir in tomatoes. Return to a boil, then simmer 15 to 30 minutes, stirring often.",https://imagesvc.meredithcorp.io/v3/mm/image?url=https%3A%2F%2Fstatic.onecms.io%2Fwp-content%2Fuploads%2Fsites%2F43%2F2019%2F12%2F3016182_healing-cabbage-soup_photo-by-julieruble.jpg,JGCASE,82,8.6g,435.9mg.,0,5.2g,1.5g,Soups
Best Damn Chili,35 mins ,Soups# Stews and Chili Recipes#Chili Recipes#Beef Chili Recipes,"4 tablespoons olive oil# 1 yellow onion, chopped# 1 red bell pepper, chopped# 1 Anaheim chile pepper, chopped# 2 red jalapeno pepper, chopped# 4 garlic cloves, minced# ½ pounds lean ground beef# ¼ cup Worcestershire sauce# 1 pinch garlic powder, or to taste# 2 beef bouillon cubes# 1 (12 fluid ounce) can or bottle light beer (such as CoorsÂ®)# 1 (28 ounce) can crushed San Marzano tomatoes# 1 (14.5 ounce) can fire-roasted diced tomatoes# 1 (12 ounce) can tomato paste# ½ cup white wine# 2 tablespoons chili powder# 2 tablespoons ground cumin# 1 tablespoon brown sugar# 1 tablespoon chipotle pepper sauce# ½ teaspoons dried basil# ½ teaspoons smoked paprika# 1 teaspoon salt# ½ teaspoon dried oregano# ½ teaspoon ground black pepper# ""2 (16 ounce) cans dark red kidney beans (such as BushsÂ®)"", 1 cup sour cream# 3 tablespoons chopped fresh cilantro# ½ teaspoon ground cumin","Heat oil in a large pot over medium heat; cook and stir onion, bell pepper, Anaheim pepper, jalapeno peppers, and garlic in the hot oil until softened.# Meanwhile, heat a large skillet over medium-high heat. Cook and stir beef in the hot skillet until browned and crumbly, 5 to 7 minutes; add Worcestershire sauce and garlic powder. Crumble bouillon cubes over beef and add beer. Continue to cook , scraping any browned bits from the bottom of the skillet, until liquid is hot, about 3 minutes. Stir beef mixture into pepper mixture.# Stir crushed tomatoes, diced tomatoes, tomato paste, and wine to the beef mixture. Season with chili powder, 2 tablespoons cumin, brown sugar, pepper sauce, basil, paprika, salt, oregano, and black pepper. Bring to a boil and reduce heat to medium-low. Cover and simmer until meat and vegetables are very tender and flavors have developed in the chili, about 90 minutes, stirring occasionally.# Mix kidney beans into beef and vegetables. Continue to simmer until beans are hot, about 30 minutes more.# Blend sour cream, cilantro, and remaining 1/2 teaspoon cumin in a food processor until smooth. Serve sour cream mixture with chili.",https://imagesvc.meredithcorp.io/v3/mm/image?url=https%3A%2F%2Fstatic.onecms.io%2Fwp-content%2Fuploads%2Fsites%2F43%2F2020%2F06%2F30%2F1060867.jpg,Danny Jaye,406,27.6g,1014.5mg.,74.4mg,21.1g,25.2g,Soups
Egg Drop Soup (Better than Restaurant Quality!),5 mins ,Soups# Stews and Chili Recipes#Soup Recipes,"1 cup chicken broth# ¼ teaspoon soy sauce# ¼ teaspoon sesame oil# 1 teaspoon cornstarch (Optional)# 2 teaspoons water (Optional)# 1 egg, beaten# 1 drop yellow food coloring (Optional)# 1 teaspoon chopped fresh chives teaspoon salt (Optional)# ½ teaspoon ground white pepper (Optional)","In a small saucepan, combine the chicken broth, soy sauce and sesame oil. Bring to a boil. Stir together the cornstarch and water to dissolve cornstarch; pour into the boiling broth. Stir gently while you pour in the egg and yellow food coloring if using. Season with chives, salt and pepper before serving.",https://imagesvc.meredithcorp.io/v3/mm/image?url=https%3A%2F%2Fstatic.onecms.io%2Fwp-content%2Fuploads%2Fsites%2F43%2F2019%2F12%2F972459_egg-drop-soup-better-than-restaurant-quality_photo-by-naples34102.jpg,Darren,112,4.8g,1395.7mg.,191mg,6.7g,7.5g,Soups
Overnight Blueberry French Toast,15 mins ,Breakfast and Brunch#Eggs,"12 slices day-old bread, cut into 1-inch cubes# 2 (8 ounce) packages cream cheese, cut into 1 inch cubes# 1 cup fresh blueberries# 12 eggs, beaten# 2 cups milk# 1 teaspoon vanilla extract# 1 cup white sugar# 2 tablespoons cornstarch# 1 cup water# 1 cup fresh blueberries# 1 tablespoon butter","Lightly grease a 9x13 inch baking dish. Arrange half the bread cubes in the dish, and top with cream cheese cubes. Sprinkle 1 cup blueberries over the cream cheese, and top with remaining bread cubes.# In a large bowl, mix the eggs, milk, vanilla extract, and syrup. Pour over the bread cubes. Cover, and refrigerate overnight.# Remove the bread cube mixture from the refrigerator about 30 minutes before baking. Preheat the oven to 350 degrees F (175 degrees C).# Cover, and bake 30 minutes. Uncover, and continue baking 25 to 30 minutes, until center is firm and surface is lightly browned.# In a medium saucepan, mix the sugar, cornstarch, and water. Bring to a boil. Stirring constantly, cook 3 to 4 minutes. Mix in the remaining 1 cup blueberries. Reduce heat, and simmer 10 minutes, until the blueberries burst. Stir in the butter, and pour over the baked French toast",https://imagesvc.meredithcorp.io/v3/mm/image?url=https%3A%2F%2Fimages.media-allrecipes.com%2Fuserphotos%2F381517.jpg,KARAN1946,485,51.9g,451.2mg.,279.4mg,24.8g,15.1g,Breakfast and Brunch
NutellaÂ® Pastry Christmas Tree,35 mins ,Bread#Quick Bread Recipes,"1 (17.5 ounce) package frozen puff pastry, thawed# 4 tablespoons chocolate-hazelnut spread (such as NutellaÂ®), or more to taste, at room temperature# 1 egg, lightly beaten","Preheat oven to 375 degrees F (190 degrees C). Line a baking sheet with parchment paper.# Roll out one puff pastry sheet into a large rectangle on a lightly floured surface and place on the prepared baking sheet.# Lightly score puff pastry into the shape of a Christmas tree (triangle) with a wide base. Spread chocolate-hazelnut spread over the triangle in a thin layer with the back of a spoon.# Roll out the second sheet of puff pastry to a large rectangle and place on top of the first one. Carefully trace the shape of the chocolate covered triangle underneath and cut out the Christmas tree shape and the trunk. Pull away excess pastry.# Lightly score 2 lines down the middle of the triangle to form a tree trunk that is narrower at the top and gets wider towards the base. Using the trunk as a guide, cut branches into the sides of the triangle.# Twist the branches away from you, trying to get in 2 turns on the lower branches. Continue moving up the tree, twisting away from you as you go.# Cut a small star out of the excess pastry; place on top of the tree. Brush the star and tree with beaten egg.# Bake in the preheated oven until puffy and golden brown, 12 to 15 minutes. Cool slightly, about 5 minutes. Slide onto a serving plate, using a piece of parchment paper if needed.",https://imagesvc.meredithcorp.io/v3/mm/image?url=https%3A%2F%2Fimages.media-allrecipes.com%2Fuserphotos%2F381517.jpg,geneviever,386,32.4g,168.8mg.,23.3mg,26.2g,5.8g,Bread
Boilermaker Tailgate Chili,30 mins ,Soups# Stews and Chili Recipes#Chili Recipes#Pork Chili Recipes,"2 pounds ground beef chuck# 1 pound bulk Italian sausage# 3 (15 ounce) cans chili beans, drained# 1 (15 ounce) can chili beans in spicy sauce# 2 (28 ounce) cans diced tomatoes with juice# 1 (6 ounce) can tomato paste# 1 large yellow onion, chopped# 3 stalks celery, chopped# 1 green bell pepper, seeded and chopped# 1 red bell pepper, seeded and chopped# 2 green chile peppers, seeded and chopped# 1 tablespoon bacon bits# 4 cubes beef bouillon# ½ cup beer# ¼ cup chili powder# 1 tablespoon Worcestershire sauce# 1 tablespoon minced garlic# 1 tablespoon dried oregano# 2 teaspoons ground cumin# 2 teaspoons hot pepper sauce (e.g. Tabascoâ„¢)# 1 teaspoon dried basil# 1 teaspoon salt# 1 teaspoon ground black pepper# 1 teaspoon cayenne pepper# 1 teaspoon paprika# 1 teaspoon white sugar# 1 (10.5 ounce) bag corn chips such as FritosÂ®# 1 (8 ounce) package shredded Cheddar cheese","Heat a large stock pot over medium-high heat. Crumble the ground chuck and sausage into the hot pan, and cook until evenly browned. Drain off excess grease.# Pour in the chili beans, spicy chili beans, diced tomatoes and tomato paste. Add the onion, celery, green and red bell peppers, chile peppers, bacon bits, bouillon, and beer. Season with chili powder, Worcestershire sauce, garlic, oregano, cumin, hot pepper sauce, basil, salt, pepper, cayenne, paprika, and sugar. Stir to blend, then cover and simmer over low heat for at least 2 hours, stirring occasionally.# After 2 hours, taste, and adjust salt, pepper, and chili powder if necessary. The longer the chili simmers, the better it will taste. Remove from heat and serve, or refrigerate, and serve the next day.# To serve, ladle into bowls, and top with corn chips and shredded Cheddar cheese.",https://imagesvc.meredithcorp.io/v3/mm/image?url=https%3A%2F%2Fstatic.onecms.io%2Fwp-content%2Fuploads%2Fsites%2F43%2F2017%2F10%2F890638.jpg,MIGHTYPURDUE22,600,55.3g,2092.5mg.,69.7mg,30.1g,30.8g,Soups
Pesto Pasta,5 mins ,Main Dishes#Pasta#Pesto Pasta Recipes,½ cup chopped onion# ½ tablespoons pesto# 2 tablespoons olive oil# 2 tablespoons grated Parmesan cheese# 1 (16 ounce) package pasta# salt to taste# ground black pepper to taste,"Cook pasta in a large pot of boiling water until done. Drain.# Meanwhile, heat the oil in a frying pan over medium low heat. Add pesto, onion, and salt and pepper. Cook about five minutes, or until onions are soft.# In a large bowl, mix pesto mixture into pasta. Stir in grated cheese. Serve.",https://imagesvc.meredithcorp.io/v3/mm/image?url=https%3A%2F%2Fstatic.onecms.io%2Fwp-content%2Fuploads%2Fsites%2F43%2F2021%2F10%2F27%2FPesto-Pasta-Aja.jpg,Lauren,225,32g,71.3mg.,43.5mg,7.2g,7.8g,Main Dishes
Hash Brown Casserole II,20 mins ,Side Dish#Potato#Hash Brown Potato Recipes,"1 (2 pound) package frozen hash brown potatoes, thawed# ½ cup melted butter# 1 (10.75 ounce) can condensed cream of chicken soup# 1 (8 ounce) container sour cream# ½ cup chopped onions# 2 cups shredded Cheddar cheese# 1 teaspoon salt# ¼ teaspoon ground black pepper# 2 cups crushed cornflakes cereal# ¼ cup melted butter","Preheat oven to 350 degrees F (175 degrees C).# In a large bowl, combine hash browns, 1/2 cup melted butter, cream of chicken soup, sour cream, chopped onion, Cheddar cheese, salt and pepper. Place mixture in a 3 quart casserole dish.# In a medium saucepan over medium heat, saute cornflakes in 1/4 cup melted butter, and sprinkle the mixture over the top of the casserole.# Bake covered in preheated oven for 40 minutes.",https://imagesvc.meredithcorp.io/v3/mm/image?url=https%3A%2F%2Fstatic.onecms.io%2Fwp-content%2Fuploads%2Fsites%2F43%2F2020%2F07%2F17%2F1060127.jpg,CMANSKY,321,20.9g,626.6mg.,60.6mg,27.8g,7.9g,Side Dish
Simple Beef Stroganoff,20 mins ,Main Dishes#Beef#Beef Stroganoff Recipes,1 (8 ounce) package egg noodles# 1 pound ground beef# 1 (10.75 ounce) can fat free condensed cream of mushroom soup# 1 tablespoon garlic powder# ½ cup sour cream# salt and pepper to taste,"Prepare the egg noodles according to package directions and set aside.# In a separate large skillet over medium heat, saute the ground beef over medium heat for 5 to 10 minutes, or until browned. Drain the fat and add the soup and garlic powder. Simmer for 10 minutes, stirring occasionally.# Remove from heat and combine the meat mixture with the egg noodles. Add the sour cream, stirring well, and season with salt and pepper to taste.",https://imagesvc.meredithcorp.io/v3/mm/image?url=https%3A%2F%2Fstatic.onecms.io%2Fwp-content%2Fuploads%2Fsites%2F43%2F2021%2F10%2F27%2FBeef-Stroganoff.jpg,Brenda,679,48.2g,659.8mg.,159.2mg,40.5g,28.7g,Main Dishes
Spicy Thai Basil Chicken (Pad Krapow Gai),15 mins ,World Cuisine#Asian#Thai,"1 tablespoon oyster sauce# 1 tablespoon soy sauce, or as needed# 2 teaspoons fish sauce# 1 teaspoon white sugar# 1 teaspoon brown sugar# 2 tablespoons vegetable oil# 1 pound skinless, boneless chicken thighs, coarsely chopped# ¼ cup sliced shallots# 4 cloves garlic, minced# 2 tablespoons minced Thai chilies, Serrano, or other hot pepper# 1 cup very thinly sliced fresh basil leaves# 2 cups hot cooked rice","Whisk chicken broth, oyster sauce, soy sauce, fish sauce, white sugar, and brown sugar together in a bowl until well blended.# Heat large skillet over high heat. Drizzle in oil. Add chicken and stir fry until it loses its raw color, 2 to 3 minutes. Stir in shallots, garlic, and sliced chilies. Continue cooking on high heat until some of the juices start to caramelize in the bottom of the pan, about 2 or 3 more minutes. Add about a tablespoon of the sauce mixture to the skillet; cook and stir until sauce begins to caramelize, about 1 minute.# Pour in the rest of the sauce. Cook and stir until sauce has deglazed the bottom of the pan. Continue to cook until sauce glazes onto the meat, 1 or 2 more minutes. Remove from heat.# Stir in basil. Cook and stir until basil is wilted, about 20 seconds. Serve with rice.",https://imagesvc.meredithcorp.io/v3/mm/image?url=https%3A%2F%2Fstatic.onecms.io%2Fwp-content%2Fuploads%2Fsites%2F43%2F2021%2F07%2F15%2F4507925-spicy-thai-basil-chicken-pad-krapow-gai-photo-by-chef-john-cropped.jpg,Chef John,715,58.6g,1181.9mg.,155.9mg,30g,49.8g,World Cuisine
Slow Cooker Chicken and Dumplings,10 mins ,Soups# Stews and Chili Recipes#Soup Recipes#Chicken Soup Recipes#Chicken and Dumpling Recipes,"4 skinless, boneless chicken breast halves# 2 tablespoons butter# 2 (10.75 ounce) cans condensed cream of chicken soup# 1 onion, finely diced# 2 (10 ounce) packages refrigerated biscuit dough, torn into pieces","Place the chicken, butter, soup, and onion in a slow cooker, and fill with enough water to cover.# Cover, and cook for 5 to 6 hours on High. About 30 minutes before serving, place the torn biscuit dough in the slow cooker. Cook until the dough is no longer raw in the center.",https://imagesvc.meredithcorp.io/v3/mm/image?url=https%3A%2F%2Fstatic.onecms.io%2Fwp-content%2Fuploads%2Fsites%2F43%2F2017%2F09%2F806223-Slow-Cooker-Chicken-and-Dumplings-photo-by-KGora1.jpg,Janiece Mason,385,37g,1244.6mg.,44.8mg,18g,18.1g,Soups
Clone of a Cinnabon,20 mins ,Bread#Pastries#Cinnamon Roll Recipes,"1 cup warm milk (110 degrees F/45 degrees C)# 2 eggs, room temperature# 1 cup margarine, melted# ½ cups bread flour# 1 teaspoon salt# ½ cup white sugar# ½ teaspoons bread machine yeast# 1 cup brown sugar, packed#½ tablespoons ground cinnamon# 1 (3 ounce) package cream cheese, softened# ¼ cup butter, softened# ½ cups confectioners sugar, ½ teaspoon vanilla extract ","Place ingredients in the pan of the bread machine in the order recommended by the manufacturer. Select dough cycle; press Start.# After the dough has doubled in size turn it out onto a lightly floured surface, cover and let rest for 10 minutes. In a small bowl, combine brown sugar and cinnamon.# Roll dough into a 16x21-inch rectangle. Spread dough with 1/3 cup butter and sprinkle evenly with sugar/cinnamon mixture. Roll up dough and cut into 12 rolls. Place rolls in a lightly greased 9x13 inch baking pan. Cover and let rise until nearly doubled, about 30 minutes. Meanwhile, preheat oven to 400 degrees F (200 degrees C).# ""Bake rolls in preheated oven until golden brown, about 15 minutes. While rolls are baking, beat together cream cheese, 1/4 cup butter, confectioners sugar, vanilla extract and salt. Spread frosting on warm rolls before serving.""",https://imagesvc.meredithcorp.io/v3/mm/image?url=https%3A%2F%2Fstatic.onecms.io%2Fwp-content%2Fuploads%2Fsites%2F43%2F2020%2F04%2F08%2FClone-of-a-Cinnabon-by-abrooks-2000.jpg,Marsha Fernandez,502,77.3g,387.7mg.,64.1mg,18.5g,8.2g,Bread
The Perfect Cinnamon Roll Icing,10 mins ,Desserts#Frostings and Icings,"2 ounces cream cheese, softened# 7 tablespoons butter, softened# ½ teaspoon vanilla extract# 2 tablespoons milk# ""½ cups confectioners sugar, sifted"", ¼ teaspoon salt","""Beat together the cream cheese and butter with an electric mixer in a large bowl until creamy. Mix in the vanilla and milk, then gradually mix in the confectioners sugar and salt until smooth and fluffy.""",https://imagesvc.meredithcorp.io/v3/mm/image?url=https%3A%2F%2Fstatic.onecms.io%2Fwp-content%2Fuploads%2Fsites%2F43%2F2020%2F09%2F14%2F1576692_original.jpg,Cara McGuire,69,7.9g,55.7mg.,11.6mg,4.2g,0.3g,Desserts
Quick and Easy Yorkshire Pudding,10 mins ,Bread#Quick Bread Recipes#Popovers and Yorkshire Pudding Recipes,3 eggs# 1 cup milk# 1 cup all-purpose flour# 2 tablespoons butter,"Preheat oven to 375 degrees F (190 degrees C).# In a medium bowl, beat eggs with milk. Stir in flour. Set aside.# Divide butter evenly into the twelve cups of a muffin tin, about 1/2 teaspoon per cup. Place tin in oven to melt butter, 2 to 5 minutes. Remove tin from oven, and distribute batter evenly among buttery cups.# Bake in preheated oven 5 minutes. Reduce heat to 350 degrees F (175 degrees C), and bake 25 minutes more or until puffed and golden.",https://imagesvc.meredithcorp.io/v3/mm/image?url=https%3A%2F%2Fstatic.onecms.io%2Fwp-content%2Fuploads%2Fsites%2F43%2F2021%2F10%2F27%2FQuick-and-Easy-Yorkshire-Pudding.jpg,BLU_17,83,9g,39.7mg.,53.2mg,3.7g,3.3g,Bread
Southern Fried Cabbage,5 mins ,Side Dish#Vegetables,"3 slices bacon, cut into thirdsl# 1 teaspoon salt, or to taste# 1 teaspoon ground black pepper, or to taste# 1 head cabbage, cored and sliced# 1 white onion, chopped# 1 pinch white sugar","Place the bacon and vegetable oil into a large pot over medium heat. Season with salt and pepper. Cook for about 5 minutes, or until bacon is crisp. Add cabbage, onion, and sugar to the pot; cook and stir continuously for 5 minutes, until tender.",https://imagesvc.meredithcorp.io/v3/mm/image?url=https%3A%2F%2Fstatic.onecms.io%2Fwp-content%2Fuploads%2Fsites%2F43%2F2021%2F04%2F08%2F6537108_original-2000.jpg,JNADX3,189,13.6g,527.8mg.,5mg,14.2g,4.4g,Side Dish
Gyoza Sauce,15 mins ,Side Dish#Sauces and Condiments#Sauces,"½ cup rice vinegar# ½ cup low-sodium soy sauce# ½ teaspoon crushed red pepper flakes# 1 garlic clove, minced# ½ teaspoon minced fresh ginger roots# 1 teaspoon sesame oil","Whisk together the rice vinegar, soy sauce, red pepper flakes, garlic, ginger, green onions, and sesame oil in a bowl; allow to sit 15 minutes before serving. Store in refrigerator up to 1 week.",https://imagesvc.meredithcorp.io/v3/mm/image?url=https%3A%2F%2Fstatic.onecms.io%2Fwp-content%2Fuploads%2Fsites%2F43%2F2021%2F04%2F08%2F6537108_original-2000.jpg,Rebecca Friedman,8,1g,266mg.,0,0.3g,0.5g,Side Dish
