title,preptime,category,ingredients,instructions,picture_link,recipeby,calories,carbohydrates,sodium,cholestrol,fat,protiens,Main_Category
Best Chocolate Chip Cookies,10 mins ,Desserts#Cookies#Chocolate Chip Cookie Recipes,"1 cup butter, softened# 1 cup white sugar# 1 cup packed brown sugar# 2 eggs# 2 teaspoons vanilla extract# 1 teaspoon baking soda# 2 teaspoons hot water#½ teaspoon salt# 3 cups all-purpose flour# 2 cups semisweet chocolate chips# 1 cup chopped walnuts","Preheat oven to 350 degrees F (175 degrees C).# Cream together the butter, white sugar, and brown sugar until smooth. Beat in the eggs one at a time, then stir in the vanilla. Dissolve baking soda in hot water. Add to batter along with salt. Stir in flour, chocolate chips, and nuts. Drop by large spoonfuls onto ungreased pans.# Bake for about 10 minutes in the preheated oven, or until edges are nicely browned.",https://imagesvc.meredithcorp.io/v3/mm/image?url=https%3A%2F%2Fstatic.onecms.io%2Fwp-content%2Fuploads%2Fsites%2F43%2F2022%2F03%2F08%2F10813-best-chocolate-chip-cookies-mfs-step-7-148.jpg,Chef John,298,38.9g,165.8mg.,35.8mg,15.6g,3.6g,Desserts
Lemon Caper Butter Sauce,5 mins ,Side Dish#Sauces and Condiments#Sauces,"1 tablespoon capers#½ teaspoon butter# 2 lemons, juiced# salt and ground black pepper to taste# 2 tablespoons cold butter# 1 teaspoon chopped fresh savory","Crush capers in a small bowl with the back of a spoon.n# Melt 1/2 teaspoon butter in a skillet over medium-high heat until the butter foams and is golden; saute capers until fragrant, about 15 seconds. Add lemon juice, bring to a simmer, and cook, stirring frequently, until liquid is reduced by one-third, 1 to 3 minutes. Season with salt and pepper. Remove from heat.n# Stir cold butter and savory into lemon mixture, stirring constantly until butter is completely melted and sauce is shiny and thick, about 1 minute.n",https://imagesvc.meredithcorp.io/v3/mm/image?url=https%3A%2F%2Fimages.media-allrecipes.com%2Fuserphotos%2F1879579.jpg,marybakes,269,24.6g,594.7mg.,66.4mg,25.8g,3.2g,Side Dish
Ghormeh Sabzi (Persian Herb Stew),2 hrs 24 mins ,Soups# Stews and Chili Recipes#Stews#Beef,"¼ cup canola oil, divided# 1 large yellow onion, finely chopped# 1 teaspoon ground turmeric# ½ pounds boneless chuck roast, cut into 1 1/2-inch cubes# ½ cups finely chopped spinach# 1 cup finely chopped green onions (green part only)#½ cup finely chopped Italian flat-leaf parsley#¼ cup finely chopped cilantro#¼ cup finely chopped chives#¼ cup finely chopped fenugreek leaves# ½ cups water, or more as needed# salt and ground black pepper to taste# 1 lemon, juiced# 4 dried Persian limes (limoo amani), or more to taste# 1 (15 ounce) can red kidney beans, drained and rinsed","Heat 2 tablespoons oil in a large pot over medium-high heat. Add onion; cook and stir until deep golden brown, 10 to 15 minutes. Stir in turmeric for 1 to 2 minutes. Add chuck cubes; cook until coated in turmeric and browned on all sides, 8 to 10 minutes.# Heat remaining 2 tablespoons oil in a separate pot over medium heat. Add spinach, green onions, parsley, cilantro, chives, and fenugreek leaves; cook and stir until deep dark green in color, 5 to 10 minutes.# Stir spinach mixture into the onion and chuck mixture. Pour in enough water to create a slurry consistency. Season with salt and pepper. Pour in lemon juice. Reduce heat, cover, and simmer stew until greens soften, about 1 hour.# Pierce dried limes with a fork and add to the stew. Continue simmering until chuck is tender, 30 minutes to 1 hour. Stir in red kidney beans. Cook until flavors combine, about 30 minutes. Discard dried limes before serving.",https://imagesvc.meredithcorp.io/v3/mm/image?url=https%3A%2F%2Fimages.media-allrecipes.com%2Fuserphotos%2F5071244.jpg,Auntie KK,344,18.6g,226mg.,51.5mg,22.6g,18.4g,Soups
Baked Ham,5 hrs ,Main Dishes#Pork#Ham#Whole,"1 (12 pound) bone-in ham, rump portion#½ cup whole cloves# 1 cup packed brown sugar# 4 cups water, or as needed","Preheat the oven to 350 degrees F (175 degrees C).# Place ham in a roasting pan, and press whole cloves into the top at 1 to 2 inch intervals. Pack the top with a layer of brown sugar. Pour enough water into the bottom of the roasting pan to come to a 1 inch depth. Cover the pan tightly with aluminum foil or a lid.# Bake for 4 1/2 to 5 hours in the preheated oven (about 22 minutes per pound), or until the internal temperature of the ham has reached 160 degrees F (72 degrees C). Make sure the meat thermometer is not touching the bone. Let stand for about 20 minutes before carving.",https://imagesvc.meredithcorp.io/v3/mm/image?url=https%3A%2F%2Fimages.media-allrecipes.com%2Fuserphotos%2F8883159.jpg&w=1200&h=678&c=sc&poi=face&q=60,Chef John,635,13.5g,2847.6mg.,148.1mg,40.2g,51.7g,Main Dishes
Drunken Mussels,10 mins ,Seafood#Shellfish#Mussels,"2 tablespoons butter# 4 cloves garlic, minced#½ teaspoon red pepper flakes, or to taste# 1 lemon, zested# 2 cups white wine# freshly ground black pepper to taste# 2 pounds mussels, cleaned and debearded# 1 cup chopped fresh flat-leaf parsley# 2 slices bread, grilled# 2 lemon wedges for garnish","Melt butter in a large stock pot over medium heat. Add garlic and let sizzle for about 30 seconds. Season with red pepper flakes and lemon zest, stirring for about 45 seconds.# Quickly pour in wine into the pan and season with black pepper. Bring sauce to a boil, stir in mussels, and cover immediately. Shake pot and let boil for 1 minute.# Stir mussels, replace cover, and let boil for 2 more minutes. The shells will begin to open. Stir in parsley, cover pot, and cook until all shells are open, 1 to 3 minutes.# Serve with grilled bread and lemon wedge.",https://imagesvc.meredithcorp.io/v3/mm/image?url=https%3A%2F%2Fimages.media-allrecipes.com%2Fuserphotos%2F2318004.jpg,CANDYLOTUS,553,40.5g,620.1mg.,91.2mg,14.8g,28.1g,Seafood
Baked Pork Chops with Cream of Mushroom Soup,1 hr ,Main Dishes#Pork#Pork Chop Recipes#Baked,"½ yellow onion, sliced# 4 pork chops# 26 ounces condensed cream of mushroom soup#¼ cup water# 2 cubes beef bouillon","Preheat the oven to 325 degrees F (165 degrees C).# Place sliced onion pieces on the bottom of a glass baking dish. Lay pork chops over the onions. Cover chops evenly with cream of mushroom soup. Add water and bouillon to the top, breaking up bouillon cubes to get the flavor spread out. Cover with aluminum foil.# Bake in the preheated oven, stirring the gravy once or twice, until no longer pink in the centers, about 1 hour. An instant-read thermometer inserted into the center of a chop should read 145 degrees F (63 degrees C).",https://imagesvc.meredithcorp.io/v3/mm/image?url=https%3A%2F%2Fimages.media-allrecipes.com%2Fuserphotos%2F9383882.jpg,Chef John,419,13.8g,1673.5mg.,106.6mg,19.8g,44.2g,Main Dishes
Chef John's Irish Soda Bread,45 mins ,Bread#Quick Bread Recipes#Irish Soda Bread Recipes,"¼ cups all-purpose flour#½ cup whole wheat flour#¼ cup rolled oats# ¼ teaspoons baking soda# 1 teaspoon baking powder# ½ teaspoons salt#¼ cup cold unsalted butter, cut into small cubes# ¾ cups buttermilk# 1 large egg# 2 tablespoons honey, or more to taste# 2 teaspoons grated orange zest# 1 cup dried currants#…“ cup golden raisins","Preheat oven to 375 degrees F (190 degrees C). Line a baking sheet with parchment paper or silicone baking mat.# Whisk all-purpose flour, whole wheat flour, oats, baking soda, baking powder, and salt together in a bowl. Cut butter into flour mixture using a pastry blender until mixture resembles coarse meal.# Beat buttermilk, egg, honey, and orange zest together in a bowl. Pour buttermilk mixture, currants, and raisins into flour mixture; stir with a wooden spoon until a wet, sticky dough comes together.# Turn dough out onto a well-floured work surface; press dough together into a soft ball of dough and cut into 2 pieces. Form each half into a smooth, round loaf. Transfer to prepared baking sheet and let rest for 15 minutes. Cut a 1/2-inch deep ""X"" into the top of each loaf with a serrated knife.# Bake in the preheated oven until golden brown and fragrant, about 45 minutes. Transfer loaves to a wire rack to cool completely before slicing.",https://imagesvc.meredithcorp.io/v3/mm/image?url=https%3A%2F%2Fimages.media-allrecipes.com%2Fuserphotos%2F4487313.jpg,Dbisbill,195,36g,381.7mg.,20.3mg,3.9g,5.1g,Bread
Veggie Pot Pie,1 hr ,Main Dishes#Savory Pie Recipes#Vegetarian Pie,"2 tablespoons olive oil# 1 onion, chopped# 8 ounces mushrooms# 1 clove garlic, minced# 2 large carrots, diced# 2 potatoes, peeled and diced# 2 stalks celery, sliced 1/4 inch wide# 2 cups cauliflower florets# 1 cup fresh green beans, trimmed and snapped into 1/2 inch pieces# 3 cups vegetable broth# 1 teaspoon kosher salt# 1 teaspoon ground black pepper# 2 tablespoons cornstarch# 2 tablespoons soy sauce# 1 recipe pastry for double-crust pie","Preheat oven to 425 degrees F (220 degrees C).# Heat oil in a large skillet or saucepan. Cook onions, mushrooms, and garlic in oil for 3 to 5 minutes, stirring frequently. Stir in carrots, potatoes, and celery. Stir in cauliflower, green beans, and vegetable broth. Bring to a boil, then turn heat down to a simmer. Cook until vegetables are barely tender, about 5 minutes. Season with salt and pepper.# In a small bowl, mix the cornstarch, soy sauce, and 1/4 cup water until cornstarch is completely dissolved. Stir into vegetables, and cook until sauce thickens, about 3 minutes.# Roll out 1/2 of the dough to line an 11x7 inch baking dish. Pour the filling into the pastry lined dish. Roll out remaining dough, arrange over the filling, and seal and flute the edges.# Bake in preheated oven for 30 minutes, or until the crust is brown.",https://imagesvc.meredithcorp.io/v3/mm/image?url=https%3A%2F%2Fstatic.onecms.io%2Fwp-content%2Fuploads%2Fsites%2F43%2F2020%2F05%2F11%2F7765387.jpg,SANDI,469,54.4g,1198.2mg.,0,25g,8.4g,Main Dishes
Hamantashen,15 mins ,Desserts#Cookies,"½ cups butter or margarine, softened# 1 cup white sugar# 2 eggs# 6 tablespoons orange juice# 1 tablespoon vanilla extract# 2 teaspoons baking powder#½ cups all-purpose flour# 1 (12 ounce) can poppyseed filling","In a large bowl, cream together the butter and sugar until smooth. Beat in the eggs one at a time, then stir in the orange juice and vanilla. Mix in the baking powder, then gradually stir in the flour until the dough forms a ball. Cover and refrigerate at least 2 hours. I like to do mine overnight.# Preheat the oven to 375 degrees F (190 degrees C). Grease cookie sheets.# On a lightly floured surface, roll the dough out to 1/4 inch thickness. Cut into 3 inch circles using a cookie cutter or drinking glass. Place circles on the prepared cookie sheets. Spoon 1 teaspoon of filling onto the center of each circle. (Any more and it will ooze out) Pinch the sides of each circle to form a triangle, covering as much of the filling as possible. The cookies may be frozen on the cookie sheets if desired to help retain their shape while cooking.# Bake for 8 to 10 minutes in the preheated oven, until light golden brown. These are best undercooked slightly. Cool on the baking sheet for a few minutes before removing to wire racks to cool completely.",https://imagesvc.meredithcorp.io/v3/mm/image?url=https%3A%2F%2Fimages.media-allrecipes.com%2Fuserphotos%2F5180093.jpg,Robyn Michelle,184,23.4g,85.7mg.,30.7mg,8.9g,2.5g,Desserts
Black Bottom Cupcakes I,30 mins ,Desserts#Cakes#Holiday Cake Recipes,"1 (8 ounce) package cream cheese, softened# 1 egg#…“ cup white sugar#…› teaspoon salt# 1 cup miniature semisweet chocolate chips# ½ cups all-purpose flour# 1 cup white sugar#¼ cup unsweetened cocoa powder# 1 teaspoon baking soda#½ teaspoon salt# 1 cup water#…“ cup vegetable oil# 1 tablespoon cider vinegar# 1 teaspoon vanilla extract","Preheat oven to 350 degrees F (175 degrees C). Line muffin tins with paper cups or lightly spray with non-stick cooking spray.# In a medium bowl, beat the cream cheese, egg, 1/3 cup sugar and 1/8 teaspoon salt until light and fluffy. Stir in the chocolate chips and set aside.# In a large bowl, mix together the flour, 1 cup sugar, cocoa, baking soda and 1/2 teaspoon salt. Make a well in the center and add the water, oil, vinegar and vanilla. Stir together until well blended. Fill muffin tins 1/3 full with the batter and top with a dollop of the cream cheese mixture.# Bake in preheated oven for 25 to 30 minutes.",https://imagesvc.meredithcorp.io/v3/mm/image?url=https%3A%2F%2Fimages.media-allrecipes.com%2Fuserphotos%2F50624.jpg,Helena W,171,22.4g,145mg.,18mg,8.9g,2.3g,Desserts
Pork Sinigang,1 hr ,Soups# Stews and Chili Recipes#Soup Recipes#Pork Soup Recipes,"1 tablespoon vegetable oil# 1 small onion, chopped# 1 teaspoon salt# 1 (1/2 inch) piece fresh ginger, chopped# 2 plum tomatoes, cut into 1/2-inch dice# 1 pound bone-in pork chops# 4 cups water, more if needed# 1 (1.41 ounce) package tamarind soup base (such as Knorr®)#½ pound fresh green beans, trimmed","Heat the vegetable oil in a skillet over medium heat. Stir in the onion; cook and stir until the onion has softened and turned translucent, about 5 minutes. Season with salt. Stir in the ginger, tomatoes, and pork chops. Cover and reduce heat to medium-low. Turn the pork occasionally, until browned. Pour in the water and tamarind soup base. Bring to a boil, then reduce heat. Continue simmering until the pork is tender and cooked through, about 30 minutes. Stir in green beans and cook until tender.",https://imagesvc.meredithcorp.io/v3/mm/image?url=https%3A%2F%2Fimages.media-allrecipes.com%2Fuserphotos%2F2926143.jpg,malgal,240,12.2g,2598.3mg.,63.5mg,9.1g,26.5g,Soups
Virgin Strawberry Daiquiri,5 mins ,World Cuisine#Latin American#Caribbean,"2 large strawberries, hulled#¼ cup white sugar# 1 tablespoon lemon juice#¾ cup chilled lemon-lime soda# 4 cubes ice","In the container of a blender, combine the strawberries, sugar, lemon juice and lemon-lime soda. Add the ice and blend until smooth. Pour into a fancy glass to serve.n",https://imagesvc.meredithcorp.io/v3/mm/image?url=https%3A%2F%2Fimages.media-allrecipes.com%2Fuserphotos%2F35611.jpg,mechanicmike,287,74.4g,24.6mg.,0,0.1g,0.3g,World Cuisine
Blackberry Pie I,40 mins ,Desserts#Pies#Fruit Pies#Blackberry Pie Recipes,4 cups fresh blackberries#½ cup white sugar#½ cup all-purpose flour# 1 recipe pastry for a 9 inch double crust pie# 2 tablespoons milk#¼ cup white sugar,"Preheat oven to 425 degrees F (220 degrees C).# Combine 3 1/2 cups berries with the sugar and flour. Spoon the mixture into an unbaked pie shell. Spread the remaining 1/2 cup berries on top of the sweetened berries, and cover with the top crust. Seal and crimp the edges, and cut vents in the top crust for steam to escape.# Brush the top crust with milk, and sprinkle with 1/4 cup sugar.# Bake in the preheated oven for 15 minutes. Reduce the temperature of the oven to 375 degrees F (190 degrees C), and bake for an additional 20 to 25 minutes, or until the filling is bubbly and the crust is golden brown. Cool on wire rack.",https://imagesvc.meredithcorp.io/v3/mm/image?url=https%3A%2F%2Fimages.media-allrecipes.com%2Fuserphotos%2F675137.jpg,brightlightz,248,42.1g,119.3mg.,0.3mg,8g,3.3g,Desserts
Mojitos by the Pitcher,20 mins ,Drink Recipes#Cocktail Recipes#Mojito Recipes,"½ cup white sugar# 36 leaves fresh mint, or to taste# 3 limes, quartered# 1 cup rum (such as Bacardi®)# 1 liter club soda",Muddle sugar and mint leaves together in pitcher until leaves are well broken down. Add limes and muddle until limes are juiced. Stir rum into sugar mixture; add club soda and stir until sugar is dissolved.,https://imagesvc.meredithcorp.io/v3/mm/image?url=https%3A%2F%2Fimages.media-allrecipes.com%2Fuserphotos%2F1249577.jpg,Yoly,160,20.2g,5.8mg.,0,0.1g,0.2g,Drink Recipes
Turkey Breakfast Sausage,10 mins ,Breakfast and Brunch#Meat and Seafood#Sausage,2 pounds ground turkey# 1 tablespoon brown sugar# 2 teaspoons kosher salt# ½ teaspoons ground black pepper# ½ teaspoons ground sage# ½ teaspoons ground thyme#½ teaspoon dried marjoram#½ teaspoon red pepper flakes,"Mix turkey, brown sugar, salt, black pepper, sage, thyme, marjoram, and red pepper flakes in a bowl. Shape turkey mixture into patties.# Fry patties in a large skillet over medium-high heat until golden brown and no longer pink in the center, 6 to 8 minutes.",https://imagesvc.meredithcorp.io/v3/mm/image?url=https%3A%2F%2Fimages.media-allrecipes.com%2Fuserphotos%2F9335232.jpg,John Goddard,176,2.3g,545mg.,83.8mg,8.6g,22.6g,Breakfast and Brunch
Outrageous Warm Chicken Nacho Dip,1 hr 15 mins ,Appetizers and Snacks#Dips and Spreads Recipes#Cheese Dips and Spreads Recipes#Hot Cheese Dip Recipes,"1 (14 ounce) can diced tomatoes with green chile peppers, drained# 1 (1 pound) loaf processed cheese food (such as Velveeta®), cubed# 2 large cooked skinless, boneless chicken breast halves, shredded# 1 cup sour cream#¼ cup diced green onion# ½ tablespoons taco seasoning mix# 2 tablespoons minced jalapeno pepper, or to taste (Optional)# 1 cup black beans, rinsed and drained","Place the diced tomatoes, processed cheese, chicken meat, sour cream, green onion, taco seasoning, and jalapeno pepper into a slow cooker. Cook on High, stirring occasionally until the cheese has melted and the dip is hot, 1 to 2 hours. Stir in the black beans, and cook 15 more minutes to reheat.",https://imagesvc.meredithcorp.io/v3/mm/image?url=https%3A%2F%2Fimages.media-allrecipes.com%2Fuserphotos%2F2333962.jpg,lutzflcat,232,8.7g,790.4mg.,60.2mg,13.6g,18.6g,Appetizers and Snacks
Skillet Chicken Thighs with Carrots and Potatoes,50 mins ,Meat and Poultry#Chicken#Chicken Thigh Recipes,"1 pound bone-in chicken thighs# ½ teaspoons paprika# ½ teaspoons salt, or more to taste# 1 teaspoon ground black pepper, or more to taste# 2 tablespoons vegetable oil#¾ pound baby carrots#½ pound baby potatoes, halved#½ onion, sliced# 1 cup chicken broth, divided# 1 tablespoon cornstarch","Season chicken thighs with paprika, salt, and pepper.# Heat oil in a skillet over medium-high heat. Place chicken thighs skin-side down in the skillet and cook, without moving, until golden brown, 7 to 9 minutes. Flip thighs over and cook for an additional 3 to 5 minutes. Remove from the skillet and set aside.# Add potatoes, cut side down, and cook over medium-high heat until golden brown, 3 to 5 minutes. Add carrots and onions and cook until onions are soft and translucent, 8 to 10 minutes. Stir in 3/4 cup chicken broth, scraping up all the browned bits.# Dissolve corn starch in 1/4 cup chicken broth and pour into the skillet. Stir until well combined.# Place chicken thighs over vegetables, cover, and cook until carrots are tender and chicken is no longer pink at the bone and the juices run clear, 25 to 30 minutes. An instant-read thermometer inserted near the bone should read 165 degrees F (74 degrees C). Season with additional salt and pepper if needed.",https://imagesvc.meredithcorp.io/v3/mm/image?url=https%3A%2F%2Fimages.media-allrecipes.com%2Fuserphotos%2F8572065.jpg,Chef John,350,22.4g,1297.6mg.,72.2mg,19.2g,21.5g,Meat and Poultry
Crispy Baked Chicken Thighs,50 mins ,Meat and Poultry#Chicken#Chicken Thigh Recipes,"6 skin-on, bone-in chicken thighs# salt and ground black pepper to taste# 1 pinch garlic powder, or to taste","Preheat oven to 475 degrees F (245 degrees C). Set a wire rack inside a broiler pan or baking pan.# Pat chicken thighs dry with paper towels. Lift up skin gently; sprinkle salt, pepper, and garlic powder under the skin. Replace skin. Season skin and underside of the thighs with salt, pepper, and garlic powder. Arrange on the rack.# Roast in the preheated oven until golden, about 20 minutes. Reduce oven temperature to 400 degrees F (200 degrees C). Continue roasting until juices run clear, about 30 minutes more. Let rest for 5 minutes before serving.",https://imagesvc.meredithcorp.io/v3/mm/image?url=https%3A%2F%2Fstatic.onecms.io%2Fwp-content%2Fuploads%2Fsites%2F43%2F2021%2F03%2F12%2F258878-crispybakedchickenthighs-passano-alr0321-9336-2000.jpg,Ron Shepherd,189,0.1g,90mg.,71mg,11.8g,19.2g,Meat and Poultry
The Ultimate Chili,6 hrs 10 mins ,Soups# Stews and Chili Recipes#Chili Recipes#Beef Chili Recipes,"1 pound lean ground beef# salt and pepper to taste# 3 (15 ounce) cans dark red kidney beans# 3 (14.5 ounce) cans Mexican-style stewed tomatoes# 2 stalks celery, chopped# 1 red bell pepper, chopped#¼ cup red wine vinegar# 2 tablespoons chili powder# 1 teaspoon ground cumin# 1 teaspoon dried parsley# 1 teaspoon dried basil# 1 dash Worcestershire sauce#½ cup red wine","In a large skillet over medium-high heat, cook ground beef until evenly browned. Drain off grease, and season to taste with salt and pepper.# In a slow cooker, combine the cooked beef, kidney beans, tomatoes, celery, red bell pepper, and red wine vinegar. Season with chili powder, cumin, parsley, basil and Worcestershire sauce. Stir to distribute ingredients evenly.# Cook on High for 6 hours, or on Low for 8 hours. Pour in the wine during the last 2 hours.",https://imagesvc.meredithcorp.io/v3/mm/image?url=https%3A%2F%2Fimages.media-allrecipes.com%2Fuserphotos%2F1003997.jpg,Michelle Ramey,414,49.5g,1015mg.,49.6mg,11g,28.4g,Soups
South African Melktert (Milk Tart),40 mins ,Desserts#Pies#Custard and Cream Pies,"3 tablespoons butter, melted# 1 cup white sugar# 3 egg yolks# 1 cup cake flour# 1 teaspoon baking powder#¼ teaspoon salt# 1 teaspoon vanilla extract# 4 cups milk# 3 egg white# 1 tablespoon cinnamon sugar","Preheat the oven to 375 degrees F (190 degrees C). Coat a 9-inch deep dish pie plate with vegetable oil cooking spray.# In a large bowl, mix together the butter and sugar until smooth. Add the egg yolks and beat until light and fluffy. Sift in the cake flour, baking powder and salt, and stir until well blended. Mix in the vanilla and milk. In a separate bowl, whip the egg whites to stiff peaks using an electric mixer. Fold into the batter. Pour into the prepared pie plate, and sprinkle cinnamon sugar over the top.# Bake for 25 minutes in the preheated oven, then reduce the temperature to 325 degrees F (165 degrees C). Continue to bake for 25 to 30 minutes, or until the center is set when you gently jiggle the pie. Serve hot or cold.",https://imagesvc.meredithcorp.io/v3/mm/image?url=https%3A%2F%2Fimages.media-allrecipes.com%2Fuserphotos%2F9395564.jpg,ews3942,294,46.8g,238.5mg.,98mg,8.5g,7.9g,Desserts
Perfect Flourless Orange Cake,1 hr ,Desserts#Fruit Desserts#Orange Dessert Recipes,2 whole oranges with peel# 6 eggs# 1 pinch saffron powder (Optional)# ¼ cups white sugar#½ teaspoon baking powder# ¼ cups finely ground almonds (almond meal)# 1 teaspoon finely chopped candied orange peel (Optional),"Place the oranges in a large saucepan, and add enough water to cover. Bring to a boil, and boil for 2 hours over medium heat. Check occasionally to make sure they do not boil dry. Allow the oranges to cool, then cut them open and remove the seeds. Process in a blender or food processor to a coarse pulp.# Preheat the oven to 375 degrees F (190 degrees C). Thoroughly grease a 10-inch round cake pan and line it with parchment paper.# In a large bowl, beat the eggs and sugar together using an electric mixer until thick and pale, about 10 minutes. Mix in baking powder and saffron (optional). Stir in the pureed oranges. Gently fold in almond meal and candied orange peel (optional); pour batter into the prepared pan.# Bake until a small knife inserted into the center comes out clean, about 1 hour. Allow the cake to cool in the pan. Tap out onto a serving plate when cool.",https://imagesvc.meredithcorp.io/v3/mm/image?url=https%3A%2F%2Fimages.media-allrecipes.com%2Fuserphotos%2F1116003.jpg,Michele O'Sullivan,174,21g,41.7mg.,69.8mg,8.6g,5.4g,Desserts
Pizza Cupcakes,15 mins ,Holidays and Events Recipes#Recipes for the Super Bowl®#Big Game Appetizer Recipes,"cooking spray# 8 medium cherry tomatoes# 1 (11 ounce) can refrigerated pizza crust# 8 teaspoons shredded mozzarella cheese#½ cup pizza sauce (such as Classico®)# 8 teaspoons finely chopped red onion#½ cup shredded mozzarella cheese# 8 slices pepperoni, quartered# Italian seasoning to taste# red pepper flakes to taste# garlic salt to taste","Preheat the oven to 400 degrees F (200 degrees C). Spray 8 cups of a muffin tin with cooking spray.# Finely chop cherry tomatoes and drain any liquid. Set aside.# Unroll pizza crust on a floured work surface and roll out thinly into a large rectangle. Using a 4-inch round cookie or biscuit cutter, cut 8 circles in the dough. Place dough circles in the prepared muffin cups, pressing dough into the bottom and up the sides of each cup.# Drop 1 teaspoon mozzarella into each cup. Top with 1 tablespoon of pizza sauce. Add chopped tomatoes and red onions. Add 1 tablespoon of mozzarella to each cup, and top with pepperoni. Sprinkle each cup with Italian seasoning, red pepper flakes, and garlic salt to taste.# Bake in the preheated oven until cheese is bubbling and melted, 14 to 15 minutes. Remove from the oven and let cool in the tin for about 5 minutes. Remove from the tin and serve hot.",https://imagesvc.meredithcorp.io/v3/mm/image?url=https%3A%2F%2Fimages.media-allrecipes.com%2Fuserphotos%2F9090841.jpg,Soup Loving Nicole,149,21.3g,434.6mg.,8.1mg,3.8g,6.6g,Side Dishes
